{
  "$schema": "https://raw.githubusercontent.com/agaaaptr/noir/main/schemas/release-registry.schema.json",
  "generated": "2026-10-19T07:29:58.494Z",
  "source": "npm",
  "currentBaseVersion": "1.19.3",
  "latestStable": "1.19.2",
  "latestBeta": "1.19.3-beta.1",
  "nextBeta": "1.19.3-beta.2",
  "releases": [
    {
      "baseVersion": "1.19.3",
      "fullVersion": "1.19.3-beta.1",
      "prereleaseIdentifier": "beta",
      "betaIteration": 1,
      "type": "prerelease",
      "channel": "beta",
      "npmDistTag": "beta",
      "gitTag": "v1.19.3-beta.1",
      "gitSha": "97510643eeb44c21342afdb91f831ebb1a4bc577",
      "gitBranch": "develop",
      "timestamp": "2026-10-19T07:29:58.493Z",
      "publishStatus": "published",
      "changelogRef": "https://github.com/agaaaptr/noir/blob/main/CHANGELOG.md#1193-beta1-2026-10-19"
    },
    {
      "baseVersion": "1.19.2",
      "fullVersion": "1.19.2",
      "prereleaseIdentifier": null,
      "betaIteration": null,
      "type": "stable",
      "channel": "stable",
      "npmDistTag": "latest",
      "gitTag": "v1.19.2",
      "gitSha": "973937494c60f417675b55fc65ea6bb4e9722670",
      "gitBranch": "main",
      "timestamp": "2026-10-15T07:48:38.447Z",
      "publishStatus": "published",
      "changelogRef": "https://github.com/agaaaptr/noir/blob/main/CHANGELOG.md#1192-2026-10-15"
    },
    {
      "baseVersion": "1.19.2",
      "fullVersion": "1.19.2-beta.1",
      "prereleaseIdentifier": "beta",
      "betaIteration": 1,
      "type": "prerelease",
      "channel": "beta",
      "npmDistTag": "beta",
      "gitTag": "v1.19.2-beta.1",
      "gitSha": "b890b94cd7756fbd2af8f7e874701eea8a20f758",
      "gitBranch": "develop",
      "timestamp": "2026-10-15T07:33:43.085Z",
      "publishStatus": "published",
      "changelogRef": "https://github.com/agaaaptr/noir/blob/main/CHANGELOG.md#1192-beta1-2026-10-15"
    },
    {
      "baseVersion": "1.19.1",
      "fullVersion": "1.19.1",
      "prereleaseIdentifier": null,
      "betaIteration": null,
      "type": "stable",
      "channel": "stable",
      "npmDistTag": "latest",
      "gitTag": "v1.19.1",
      "gitSha": "47b409229992135d96a9405afdf018b77b261093",
      "gitBranch": "main",
      "timestamp": "2026-10-15T05:54:32.953Z",
      "publishStatus": "published",
      "changelogRef": "https://github.com/agaaaptr/noir/blob/main/CHANGELOG.md#1191-2026-10-15"
    },
    {
      "baseVersion": "1.19.1",
      "fullVersion": "1.19.1-beta.1",
      "prereleaseIdentifier": "beta",
      "betaIteration": 1,
      "type": "prerelease",
      "channel": "beta",
      "npmDistTag": "beta",
      "gitTag": "v1.19.1-beta.1",
      "gitSha": "d9de1823422db03cfdc8a066cbd40cbbb05eb26b",
      "gitBranch": "develop",
      "timestamp": "2026-10-15T05:43:29.103Z",
      "publishStatus": "published",
      "changelogRef": "https://github.com/agaaaptr/noir/blob/main/CHANGELOG.md#1191-beta1-2026-10-15"
    },
    {
      "baseVersion": "1.19.0",
      "fullVersion": "1.19.0",
      "prereleaseIdentifier": null,
      "betaIteration": null,
      "type": "stable",
      "channel": "stable",
      "npmDistTag": "latest",
      "gitTag": "v1.19.0",
      "gitSha": "f96a8179b45254710a6897601f43607cfc9f2bc9",
      "gitBranch": "main",
      "timestamp": "2026-10-14T11:47:41.564Z",
      "publishStatus": "published",
      "changelogRef": "https://github.com/agaaaptr/noir/blob/main/CHANGELOG.md#1190-2026-10-14"
    },
    {
      "baseVersion": "1.19.0",
      "fullVersion": "1.19.0-beta.1",
      "prereleaseIdentifier": "beta",
      "betaIteration": 1,
      "type": "prerelease",
      "channel": "beta",
      "npmDistTag": "beta",
      "gitTag": "v1.19.0-beta.1",
      "gitSha": "700adb4e59f0cfbe377e054a87fa39c09b1649f7",
      "gitBranch": "develop",
      "timestamp": "2026-10-14T11:29:35.210Z",
      "publishStatus": "published",
      "changelogRef": "https://github.com/agaaaptr/noir/blob/main/CHANGELOG.md#1190-beta1-2026-10-14"
    },
    {
      "baseVersion": "1.18.0",
      "fullVersion": "1.18.0",
      "prereleaseIdentifier": null,
      "betaIteration": null,
      "type": "stable",
      "channel": "stable",
      "npmDistTag": "latest",
      "gitTag": "v1.18.0",
      "gitSha": "e274a1596bd5d0b1c1161d8d65058ac112cfa9dc",
      "gitBranch": "main",
      "timestamp": "2026-10-09T06:29:45.814Z",
      "publishStatus": "published",
      "changelogRef": "https://github.com/agaaaptr/noir/blob/main/CHANGELOG.md#1180-2026-10-09"
    },
    {
      "baseVersion": "1.18.0",
      "fullVersion": "1.18.0-beta.1",
      "prereleaseIdentifier": "beta",
      "betaIteration": 1,
      "type": "prerelease",
      "channel": "beta",
      "npmDistTag": "beta",
      "gitTag": "v1.18.0-beta.1",
      "gitSha": "efaa907a36d01de24486fe1493a66000fdb44bea",
      "gitBranch": "develop",
      "timestamp": "2026-10-09T06:06:13.510Z",
      "publishStatus": "published",
      "changelogRef": "https://github.com/agaaaptr/noir/blob/main/CHANGELOG.md#1180-beta1-2026-10-09"
    },
    {
      "baseVersion": "1.17.0",
      "fullVersion": "1.17.0",
      "prereleaseIdentifier": null,
      "betaIteration": null,
      "type": "stable",
      "channel": "stable",
      "npmDistTag": "latest",
      "gitTag": "v1.17.0",
      "gitSha": "eb6c8dde1b99a7dc2e98bab924a7892f03f601a8",
      "gitBranch": "main",
      "timestamp": "2026-10-08T09:39:24.747Z",
      "publishStatus": "published",
      "changelogRef": "https://github.com/agaaaptr/noir/blob/main/CHANGELOG.md#1170-2026-10-08"
    },
    {
      "baseVersion": "1.17.0",
      "fullVersion": "1.17.0-beta.1",
      "prereleaseIdentifier": "beta",
      "betaIteration": 1,
      "type": "prerelease",
      "channel": "beta",
      "npmDistTag": "beta",
      "gitTag": "v1.17.0-beta.1",
      "gitSha": "10e3fe4169b9fe52ea339670694d70c0981cd2a6",
      "gitBranch": "develop",
      "timestamp": "2026-10-08T09:22:39.183Z",
      "publishStatus": "published",
      "changelogRef": "https://github.com/agaaaptr/noir/blob/main/CHANGELOG.md#1170-beta1-2026-10-08"
    },
    {
      "baseVersion": "1.16.0",
      "fullVersion": "1.16.0",
      "prereleaseIdentifier": null,
      "betaIteration": null,
      "type": "stable",
      "channel": "stable",
      "npmDistTag": "latest",
      "gitTag": "v1.16.0",
      "gitSha": "9a4eabfd4977170bb335cea5b242f71dce927f9e",
      "gitBranch": "main",
      "timestamp": "2026-09-25T06:36:02.483Z",
      "publishStatus": "published",
      "changelogRef": "https://github.com/agaaaptr/noir/blob/main/CHANGELOG.md#1160-2026-09-25"
    },
    {
      "baseVersion": "1.16.0",
      "fullVersion": "1.16.0-beta.1",
      "prereleaseIdentifier": "beta",
      "betaIteration": 1,
      "type": "prerelease",
      "channel": "beta",
      "npmDistTag": "beta",
      "gitTag": "v1.16.0-beta.1",
      "gitSha": "909eb06b1b217e44718e472903d782348e49719c",
      "gitBranch": "develop",
      "timestamp": "2026-09-25T06:09:40.115Z",
      "publishStatus": "published",
      "changelogRef": "https://github.com/agaaaptr/noir/blob/main/CHANGELOG.md#1160-beta1-2026-09-25"
    },
    {
      "baseVersion": "1.15.0",
      "fullVersion": "1.15.0",
      "prereleaseIdentifier": null,
      "betaIteration": null,
      "type": "stable",
      "channel": "stable",
      "npmDistTag": "latest",
      "gitTag": "v1.15.0",
      "gitSha": "b20e7a3a2c464cc67b50752a180486aa0eacb1dc",
      "gitBranch": "main",
      "timestamp": "2026-09-16T05:35:32.893Z",
      "publishStatus": "published",
      "changelogRef": "https://github.com/agaaaptr/noir/blob/main/CHANGELOG.md#1150-2026-09-16"
    },
    {
      "baseVersion": "1.15.0",
      "fullVersion": "1.15.0-beta.1",
      "prereleaseIdentifier": "beta",
      "betaIteration": 1,
      "type": "prerelease",
      "channel": "beta",
      "npmDistTag": "beta",
      "gitTag": "v1.15.0-beta.1",
      "gitSha": "afe838902202f546a6baf9fdfca663a4339659e4",
      "gitBranch": "develop",
      "timestamp": "2026-09-16T05:23:15.668Z",
      "publishStatus": "published",
      "changelogRef": "https://github.com/agaaaptr/noir/blob/main/CHANGELOG.md#1150-beta1-2026-09-16"
    },
    {
      "baseVersion": "1.14.0",
      "fullVersion": "1.14.0",
      "prereleaseIdentifier": null,
      "betaIteration": null,
      "type": "stable",
      "channel": "stable",
      "npmDistTag": "latest",
      "gitTag": "v1.14.0",
      "gitSha": "00c2f6b628c08f8f981d6d5d193b0d355fabdedd",
      "gitBranch": "main",
      "timestamp": "2026-09-11T11:49:54.374Z",
      "publishStatus": "published",
      "changelogRef": "https://github.com/agaaaptr/noir/blob/main/CHANGELOG.md#1140-2026-09-11"
    },
    {
      "baseVersion": "1.14.0",
      "fullVersion": "1.14.0-beta.1",
      "prereleaseIdentifier": "beta",
      "betaIteration": 1,
      "type": "prerelease",
      "channel": "beta",
      "npmDistTag": "beta",
      "gitTag": "v1.14.0-beta.1",
      "gitSha": "df5bc0f4dd349e67c9bdb3ef12284ce69b0aa27f",
      "gitBranch": "develop",
      "timestamp": "2026-09-11T11:37:58.263Z",
      "publishStatus": "published",
      "changelogRef": "https://github.com/agaaaptr/noir/blob/main/CHANGELOG.md#1140-beta1-2026-09-11"
    },
    {
      "baseVersion": "1.13.0",
      "fullVersion": "1.13.0",
      "prereleaseIdentifier": null,
      "betaIteration": null,
      "type": "stable",
      "channel": "stable",
      "npmDistTag": "latest",
      "gitTag": "v1.13.0",
      "gitSha": "19efd2a62f7711eb25b070b848ed5ad52758443e",
      "gitBranch": "main",
      "timestamp": "2026-09-10T03:55:26.871Z",
      "publishStatus": "published",
      "changelogRef": "https://github.com/agaaaptr/noir/blob/main/CHANGELOG.md#1130-2026-09-10"
    },
    {
      "baseVersion": "1.13.0",
      "fullVersion": "1.13.0-beta.1",
      "prereleaseIdentifier": "beta",
      "betaIteration": 1,
      "type": "prerelease",
      "channel": "beta",
      "npmDistTag": "beta",